{
  "id": "andyai.minimal.status",
  "version": "0.4.0",
  "title": "Minimal Status Skill",
  "purpose": "Turn simple execution state into a concise structured summary.",
  "inputs": [
    {
      "name": "state",
      "type": "string"
    }
  ],
  "outputs": [
    {
      "name": "summary",
      "type": "string"
    }
  ],
  "trust": {
    "evidence_required": false
  }
}